{
  "$schema": "https://json-schema.org/draft/2020-12/schema",
  "$id": "https://schema.tbdevent.eu/terrain-manifest/v1.json",
  "title": "TBD Terrain Manifest",
  "description": "Per-terrain map asset manifest (DEM + optional tile pyramid). Values for pixel dimensions and height range must come from World Editor Info & Diags at export — do not guess.",
  "type": "object",
  "required": [
    "terrainId",
    "schemaVersion",
    "worldBounds",
    "metersPerPixel",
    "dem",
    "precision"
  ],
  "additionalProperties": false,
  "properties": {
    "terrainId": {
      "type": "string",
      "minLength": 1,
      "description": "Terrain key — must match an entry in terrain-registry.json (same id namespace as packages/map-assets/{terrainId}/)."
    },
    "schemaVersion": { "type": "integer", "minimum": 1 },
    "worldBounds": {
      "type": "array",
      "description": "[minX, minY, maxX, maxY] meters — must match coords/terrains.ts",
      "items": { "type": "number" },
      "minItems": 4,
      "maxItems": 4
    },
    "metersPerPixel": {
      "type": "number",
      "description": "Planar resolution from Info & Diags (Everon Biki: 2 m)."
    },
    "dem": {
      "type": "object",
      "required": [
        "path",
        "widthPx",
        "heightPx",
        "encoding",
        "heightRangeMinM",
        "heightRangeMaxM",
        "source"
      ],
      "additionalProperties": false,
      "properties": {
        "path": { "type": "string" },
        "widthPx": { "type": "integer", "minimum": 0, "description": "0 = stub awaiting T-091.0 export" },
        "heightPx": { "type": "integer", "minimum": 0, "description": "0 = stub awaiting T-091.0 export" },
        "encoding": { "const": "uint16-linear" },
        "heightRangeMinM": { "type": "number" },
        "heightRangeMaxM": { "type": "number" },
        "blackMapsToM": { "type": "number" },
        "whiteMapsToM": { "type": "number" },
        "source": {
          "type": "string",
          "enum": [
            "reforger-world-editor-base-png",
            "reforger-world-editor-modified-png",
            "asc-converted",
            "mod-getsurfacey-resample"
          ]
        },
        "exportedAt": { "type": "string", "format": "date-time" },
        "workbenchVersion": { "type": "string" },
        "axisFlip": {
          "type": "object",
          "properties": {
            "x": { "type": "boolean" },
            "z": { "type": "boolean" }
          }
        },
        "raw": {
          "type": "object",
          "description": "T-935 (spec §3.2) — the TBDE raw-u16 twin of the DEM PNG, streamed into one Vec<u16> instead of decoded through a PNG codec. OPTIONAL: absent means the PNG above is the only elevation source. Mirrors DemRawBlock in crates/map-engine-core/src/world/manifest.rs.",
          "additionalProperties": false,
          "required": ["path", "encoding"],
          "properties": {
            "path": { "type": "string", "description": "Relative to packages/map-assets/{terrainId}/, e.g. dem/elevation.dem." },
            "encoding": { "const": "tbde-v1" }
          }
        }
      }
    },
    "tiles": {
      "type": "object",
      "description": "Dual basemap pyramids (T-090.1/.1.1, N9). Legacy single `urlTemplate` = satellite alias (live everon manifest unchanged). `satellite` + `map` are the Google-Maps-style switchable views; both share bounds/zoom and the XYZ disk layout + fetch-time Y inversion.",
      "properties": {
        "type": { "const": "xyz" },
        "indexOrder": { "type": "string", "enum": ["xyz", "tms"] },
        "urlTemplate": { "type": "string" },
        "tileSizePx": { "type": "integer" },
        "minZoom": { "type": "integer" },
        "maxZoom": { "type": "integer" },
        "bounds": {
          "type": "array",
          "items": { "type": "number" },
          "minItems": 4,
          "maxItems": 4
        },
        "alignmentOrigin": {
          "type": "array",
          "items": { "type": "number" },
          "minItems": 2,
          "maxItems": 2
        },
        "satellite": {
          "type": "object",
          "additionalProperties": false,
          "properties": {
            "path": { "type": "string" },
            "urlTemplate": { "type": "string" },
            "source": {
              "type": "string",
              "enum": ["workbench-ortho", "sap", "sap-supertexture-stitch", "color-ortho"]
            },
            "encoding": {
              "type": "string",
              "description": "Tile codec — webp-lossless (VP8L) for the picture-perfect satellite pyramid (T-090.1.2.1); webp-lossy (VP8 q=N) for interim/dev builds.",
              "enum": ["webp-lossy", "webp-lossless", "png"]
            },
            "delivery": {
              "type": "string",
              "description": "Primary satellite delivery (T-090.1.2.8): unified = one tbd-sat bundle → single GPU texture with mips; pyramid = legacy per-viewport {z}/{x}/{y} tiles. The frontend falls back to the pyramid when the unified bundle is missing/unreadable.",
              "enum": ["pyramid", "unified"]
            },
            "waterComposite": {
              "type": "boolean",
              "description": "T-090.1.2.5 — true when the satellite ortho has engine-sourced hydrology composited on (ocean = DEM <= sea level; inland = supertexture water appearance, DEM-filtered). Provenance: staging TBD_SatExport_meta.json waterComposite block + .ai/artifacts/t090_1_2_5_water_source_spike.json."
            },
            "unified": {
              "type": "object",
              "description": "Unified satellite bundle (tbd-sat v1, T-090.1.2.8): GLB-style container of lossless-WebP mip blocks, fetched once and uploaded as a single mipmapped GPU texture.",
              "additionalProperties": false,
              "required": ["path", "url", "encoding"],
              "properties": {
                "path": { "type": "string" },
                "url": { "type": "string" },
                "encoding": {
                  "type": "string",
                  "description": "tbd-sat-v1 is the shipped hand-packed tile table; tbd-sat-v2 (T-935, spec §3.5) replaces its index with an rkyv TbdSatIndexV2 behind the same magic. The reader dispatches on the file's own version field — this string only tells a loader which one to expect.",
                  "enum": ["tbd-sat-v1", "tbd-sat-v2"]
                },
                "baseWidthPx": { "type": "integer", "minimum": 1 },
                "baseHeightPx": { "type": "integer", "minimum": 1 },
                "mipCount": { "type": "integer", "minimum": 1 },
                "bytes": { "type": "integer", "minimum": 1 }
              }
            }
          }
        },
        "map": {
          "type": "object",
          "additionalProperties": false,
          "properties": {
            "path": { "type": "string" },
            "urlTemplate": { "type": "string" },
            "source": {
              "type": "string",
              "description": "N9 — synthesized-cartographic = DEM hillshade + land-cover LUT + baked road vectors when Workbench has no cartographic export; UI labels it \"Synthetic map\".",
              "enum": ["workbench-cartographic", "synthesized-cartographic"]
            },
            "encoding": {
              "type": "string",
              "description": "Tile codec — webp-lossy (VP8 q=N) is the Map-view default (stylized cartographic raster, T-090.1.1); lossless is a satellite-only requirement.",
              "enum": ["webp-lossy", "webp-lossless", "png"]
            }
          }
        }
      }
    },
    "objects": {
      "type": "object",
      "description": "Catalog v1 world-object pointers + counts (T-090.2/.3). Optional until first object export.",
      "additionalProperties": false,
      "properties": {
        "schemaVersion": { "type": "string" },
        "format": { "type": "string" },
        "prefabsPath": { "type": "string" },
        "prefabCount": { "type": "integer", "minimum": 0 },
        "instanceCount": { "type": "integer", "minimum": 0 },
        "chunksPath": { "type": "string" },
        "chunkSizeM": { "type": "number" },
        "roadsPath": { "type": "string" },
        "regionsPath": { "type": "string" },
        "importPhaseMax": { "type": "string" },
        "importPhaseShipped": { "type": "array", "items": { "type": "string" } },
        "transforms": {
          "type": "string",
          "enum": ["yaw", "yaw+pitch+roll", "yaw+pitch+roll+scale"],
          "description": "T-090.12.1 (objects schemaVersion 1.1.0): what a chunk row can carry beyond its position. `yaw` = the 5-wide v1 tuple only; `yaw+pitch+roll` = 8-wide rows exist but the export carried no scale (every scale is 1); `yaw+pitch+roll+scale` = the v2 full-export plugin wrote GetScale()."
        },
        "scaleSource": {
          "type": "string",
          "enum": ["absent", "GetScale"],
          "description": "T-090.12.1: where the per-row scale came from — `absent` (pre-v2 export, unit scale assumed everywhere) or `GetScale` (the full-export plugin v2)."
        },
        "workbenchVersion": {
          "type": "string",
          "description": "T-090.12.1: the Workbench build that produced the world export, copied from the export meta when the plugin wrote one (omitted otherwise)."
        },
        "typeInventoryPath": {
          "type": "string",
          "description": "Relative path to type-inventory.json — exact prefab/instance counts (T-090.2)."
        },
        "densityPath": {
          "type": "string",
          "description": "RESERVED (T-090.3.2): relative dir of per-chunk tree/rock corner-density grids objects/density/{cx}_{cy}.bin (TBDD binary, plan §3.3). Field documented in T-090.3.1; first written by T-090.3.2."
        },
        "densityCellM": {
          "type": "number",
          "description": "RESERVED (T-090.3.2): density grid cell size in meters — locked 32 (17×17 corners per 512 m chunk, plan Q3)."
        },
        "lod": {
          "type": "object",
          "description": "RESERVED (T-090.3.2): LOD gate constants snapshot for cache-busting (plan §3.4/§5) — refZoom + per-class minZoom gates. Field documented in T-090.3.1; first written by T-090.3.2.",
          "additionalProperties": false,
          "properties": {
            "schemaVersion": { "type": "string" },
            "refZoom": { "type": "number" },
            "gates": {
              "type": "object",
              "additionalProperties": { "type": "number" }
            }
          }
        },
        "exportedAt": { "type": "string", "format": "date-time" },
        "binary": {
          "type": "object",
          "description": "T-935 (spec §5) — the TBDC chunk container plus the four Tier-2 rkyv archives that replace the objects/*.json.gz set. OPTIONAL: absent means the JSON paths above are the only ones, which is every manifest shipped before T-935.13. Mirrors ObjectsBinaryBlock in crates/map-engine-core/src/world/manifest.rs; container/containerVersion/pod/podBytes are on the wire so a loader can REFUSE a row shape it does not implement (ObjectsBinaryBlock::matches_this_build) instead of reading a 24-byte-row file at a 32-byte stride and drawing a map made of garbage that never errors.",
          "additionalProperties": false,
          "required": ["container", "containerVersion", "pod", "podBytes", "chunks"],
          "properties": {
            "schemaVersion": { "type": "string" },
            "container": { "const": "TBDC", "description": "spec §3.1 — magic of objects/chunks/{cx}_{cy}.bin." },
            "containerVersion": { "const": 1, "description": "CONTAINER_VERSION. Pinned, not open: a v2 manifest must fail this schema until the reader that understands v2 lands." },
            "pod": { "const": "ObjectInstancePod", "description": "POD_NAME — the 32-byte row documented in map-object-instance.schema.json $defs/objectInstancePodRow." },
            "podBytes": { "const": 32, "description": "POD_BYTES. Every offset in the format is 32 + 32 * index." },
            "chunks": { "type": "string", "minLength": 1, "description": "Path template carrying BOTH {cx} and {cy}, e.g. objects/chunks/{cx}_{cy}.bin. A template missing either placeholder resolves every chunk in the world to one URL (chunk_bin_path returns None and the loader stays on JSON)." },
            "prefabs": { "type": "string", "minLength": 1, "description": "objects/prefabs.rkyv — PrefabCatalogArchive." },
            "roads": { "type": "string", "minLength": 1, "description": "roads/road_network.rkyv — RoadNetworkArchive." },
            "regions": { "type": "string", "minLength": 1, "description": "objects/forest-regions.rkyv — ForestRegionsArchive." },
            "typeInventory": { "type": "string", "minLength": 1, "description": "objects/type-inventory.rkyv; the inventory also lives inside the prefab catalogue." }
          }
        }
      }
    },
    "labels": {
      "type": "object",
      "description": "T-935 (spec §5) — the rkyv label archive replacing locations.json plus the road-name JSON. OPTIONAL. Mirrors LabelsBlock in crates/map-engine-core/src/world/manifest.rs.",
      "additionalProperties": false,
      "required": ["path", "encoding"],
      "properties": {
        "path": { "type": "string", "description": "e.g. locations/map_labels.rkyv." },
        "encoding": { "const": "rkyv-map-labels-v1" }
      }
    },
    "water": {
      "type": "object",
      "description": "T-935 (spec §3.3/§5) — water vectors as an rkyv archive and the TBDB mipmapped bathymetry raster. OPTIONAL. Mirrors WaterBlock in crates/map-engine-core/src/world/manifest.rs.",
      "additionalProperties": false,
      "required": ["vectors", "encoding"],
      "properties": {
        "vectors": { "type": "string", "description": "e.g. water/water_vectors.rkyv — WaterVectorsArchive." },
        "bathymetry": { "type": "string", "description": "e.g. water/bathymetry.tbd-bath. Absent on a terrain with no bathymetry bake." },
        "encoding": { "const": "tbdb-v1" }
      }
    },
    "buildings": {
      "type": "object",
      "description": "T-935 (spec §5) — one BuildingBlueprintArchive fetch in place of 1623 descriptor fetches, plus the directory its .bvh sidecars are indexed out of. OPTIONAL. Mirrors BuildingsBlock in crates/map-engine-core/src/world/manifest.rs.",
      "additionalProperties": false,
      "required": ["archive"],
      "properties": {
        "archive": { "type": "string", "description": "e.g. prefabs/building_blueprints.rkyv." },
        "blas": { "type": "string", "description": "Directory of the .bvh sidecars, e.g. prefabs/blas." }
      }
    },
    "glyphs": {
      "type": "object",
      "description": "World-object SVG/atlas pointers (T-090.5). Optional.",
      "additionalProperties": false,
      "properties": {
        "manifestPath": { "type": "string" },
        "atlasPath": { "type": "string" },
        "atlasJsonPath": { "type": "string" }
      }
    },
    "locations": {
      "type": "object",
      "description": "Named settlements / peaks for cartographic labels (T-152.6).",
      "additionalProperties": false,
      "required": ["path"],
      "properties": {
        "path": { "type": "string" },
        "exportedAt": { "type": "string", "format": "date-time" }
      }
    },
    "anchors": {
      "type": "array",
      "items": {
        "type": "object",
        "required": ["id", "x", "z"],
        "properties": {
          "id": { "type": "string" },
          "x": { "type": "number" },
          "z": { "type": "number" },
          "surfaceYM": { "type": "number" },
          "demYM": { "type": "number" },
          "note": { "type": "string" }
        }
      }
    },
    "precision": {
      "type": "object",
      "required": ["storageDecimals", "demNativeMetersPerPixel", "spawnAuthority"],
      "properties": {
        "storageDecimals": { "type": "integer", "minimum": 0, "maximum": 6 },
        "demNativeMetersPerPixel": { "type": "number" },
        "spawnAuthority": { "const": "mod-get-surface-y" }
      }
    }
  }
}
