{
  "terrainId": "everon",
  "schemaVersion": 1,
  "worldBounds": [0, 0, 12800, 12800],
  "metersPerPixel": 2,
  "dem": {
    "path": "dem/everon-dem-16bit.png",
    "widthPx": 6400,
    "heightPx": 6400,
    "encoding": "uint16-linear",
    "heightRangeMinM": -204.78,
    "heightRangeMaxM": 375.53,
    "blackMapsToM": -204.78,
    "whiteMapsToM": 375.53,
    "source": "mod-getsurfacey-resample",
    "exportedAt": "2026-06-29T16:12:00Z",
    "workbenchVersion": "ArmaReforger 1.7.0.54 (engine 190965, built 2026-06-14)",
    "axisFlip": { "x": false, "z": false }
  },
  "tiles": {
    "type": "xyz",
    "indexOrder": "xyz",
    "urlTemplate": "/map-assets/everon/tiles/satellite/{z}/{x}/{y}.webp",
    "tileSizePx": 256,
    "minZoom": 0,
    "maxZoom": 5,
    "bounds": [0, 0, 12800, 12800],
    "alignmentOrigin": [0, 0],
    "satellite": {
      "path": "tiles/satellite",
      "urlTemplate": "/map-assets/everon/tiles/satellite/{z}/{x}/{y}.webp",
      "source": "color-ortho"
    },
    "map": {
      "path": "tiles/map",
      "urlTemplate": "/map-assets/everon/tiles/map/{z}/{x}/{y}.webp",
      "source": "synthesized-cartographic"
    }
  },
  "objects": {
    "schemaVersion": "1.0.0",
    "format": "catalog-v1",
    "prefabsPath": "objects/prefabs.json.gz",
    "prefabCount": 0,
    "instanceCount": 0,
    "chunksPath": "objects/chunks",
    "chunkSizeM": 512,
    "roadsPath": "objects/roads.json.gz",
    "regionsPath": "objects/forest-regions.json.gz",
    "importPhaseMax": "P1_buildings",
    "importPhaseShipped": [],
    "exportedAt": "2026-06-30T00:00:00Z"
  },
  "glyphs": {
    "manifestPath": "glyphs/manifest.json",
    "atlasPath": "glyphs/atlas/world-glyphs.webp",
    "atlasJsonPath": "glyphs/atlas/world-glyphs.json"
  },
  "anchors": [],
  "precision": {
    "storageDecimals": 3,
    "demNativeMetersPerPixel": 2,
    "spawnAuthority": "mod-get-surface-y"
  }
}
